Entry,Text,Category,Image
Shield,"A shield is a tool that can be used to block damage from melee attacks, ranged attacks and explosions. Shields can be temporarily disabled by getting hit with an axe, and some attacks ignore a shield's protection. Shields can have ornamental banner designs applied to them.",Enchantment,Images/Enchantment/Enchantment.png
Shovel,"A shovel is a tool used to hasten the process of breaking dirt, sand, gravel and other soil blocks, as well as to convert dirt blocks into dirt paths.",Enchantment,Images/Enchantment/Enchantment.png
Sword,A sword is a melee weapon that is used to deal damage to entities and to break certain blocks such as cobwebs and bamboo quicker. There are six tiers of the sword.,Enchantment,Images/Enchantment/Enchantment.png
Trident,"A trident is a weapon usable both for melee attacks and as a throwable projectile that is not slowed down by water. It is obtained as a rare drop from drowned who wield them, and as rare loot from vaults in trial chambers.",Enchantment,Images/Enchantment/Enchantment.png
Turtle Shell,A turtle shell is a special type of helmet that can also be used as a brewing ingredient.,Enchantment,Images/Enchantment/Enchantment.png
Warped Fungus on a Stick,A warped fungus on a stick is an item that can be used to control saddled striders.,Enchantment,Images/Enchantment/Enchantment.png
Agent,The Agent is a interactive passive mob that is exclusive to Minecraft Education and Bedrock Edition .,Entity,Images/Entity/Agent.png
Barnacle,"Mob A, the Barnacle , [1] also called ""The Monster of the Ocean Depths"",  was a proposed mob featured in the Mob Vote during MINECON Earth 2017 , alongside the great hunger , the phantom and the wildfire . [2]",Entity,Images/Entity/Barnacle.png
Batato,"A batato is a modified version of the bat , with a poisonous potato replacing the body and head of the mob. It has the same AI as the regular bat.",Entity,Images/Entity/Batato.png
Copper Golem,"The copper golem was a proposed mob featured in the Mob Vote during Minecraft Live 2021 , alongside the allay and glare . [1] It was a golem that would have been created with copper . It would have been attracted to copper buttons, which would also come with the golem had it won. [2]",Entity,Images/Entity/Copper_Golem.png
Crab,"The crab was a proposed mob featured in the Mob Vote during Minecraft Live 2023 , alongside the armadillo and penguin . [1] It would have spawned in mangrove swamps , and had a large arm that it could lose, dropping a crab claw. The crab claw could be used to place blocks from further away. Crabs could be bred with kelp . Crabs occasionally waved at players and other crabs.",Entity,Images/Entity/Crab.png
Diamond Chicken,Diamond chickens were a rare joke variant of chicken present in the April Fool's Java Edition 2.0 . They lay lapis lazuli and diamonds instead of eggs .,Entity,Images/Entity/Diamond_Chicken.png
Firefly,"The firefly was a proposed mob featured in Minecraft Live 2021 . They were originally going to be eaten by frogs to produce froglights , but this was scrapped due to the fact that some species of fireflies are poisonous to some species of frogs in real life. [1]",Entity,Images/Entity/Firefly.png
Glare,"The glare was a proposed mob featured in the Mob Vote during Minecraft Live 2021 , alongside the allay and copper golem . [1]",Entity,Images/Entity/Glare.png
Great Hunter,"Mob C, or "" The Great Hunger "" was a proposed mob featured in the Mob Vote during MINECON Earth 2017 , alongside the barnacle , the phantom and the wildfire . [1]",Entity,Images/Entity/Great_Hunter.png
Iceologer,"The iceologer was a planned mob featured in the Mob Vote during Minecraft Live 2020 , alongside the moobloom and glow squid . [1] It would have been hostile, spawned in mountain peaks , and attacked players with large chunks of ice.",Entity,Images/Entity/Iceologer.png
Illusioner,The illusioner is an unused illager armed with a bow . It attacks using illusions and can also fire arrows .,Entity,Images/Entity/Illusioner.png
Llama,A llama is a tamable neutral mob used to transport large shipments of items.,Entity,Images/Entity/Llama.png
Love Golem,The love golem was a buildable passive mob present in the April Fool's Love and Hugs Update . It was a manifestation of the villager's love and peaceful nature.,Entity,Images/Entity/Love_Golem.png
Mega Spud,The mega spud is a boss mob found in colosseums in 24w14potato .,Entity,Images/Entity/Mega_Spud.png
MINECON,"MINECON Earth 2018 was a livestream that was streamed for an hour and a half from 16:00 to 17:30 UTC on September 29, 2018. [1] It featured Erin Wayne (Aureylian), Martyn Littlewood (InTheLittlewood), Yasmin Ayesha (Yammy), Chad Johnson (OMGchad), and Anthony (BigBStatz) as the co-hosts of the show. [2]",Entity,Images/Entity/MINECON.png
Mob,An entity referred to simply as a mob was a passive mob in very early Minecraft ( Java Edition ). This entity came with several different models across early Minecraft versions. They are an in game instance of the base mob class.,Entity,Images/Entity/Mob.png
Moobloom,"The moobloom was a mob planned to be added into Minecraft featured in the Mob Vote during Minecraft Live 2020 , alongside the iceologer and glow squid . [1] It would have been passive, and had some form of interaction with bees .",Entity,Images/Entity/Moobloom.png
Moon Cow,"A moon cow is a variant of a cow that spawns on the Moon . They function similar to the cow, except they walk backward and wear glass .",Entity,Images/Entity/Moon_Cow.png
Nerd Creeper,The nerd creeper is a hostile creeper -based mob present in the April Fool's Java Edition 3D Shareware v1.34 update.,Entity,Images/Entity/Nerd_Creeper.png
NPC,Non player characters (abbreviated as NPCs ) are interactive passive mobs that have models similar to villagers . [1],Entity,Images/Entity/NPC.png
Pink Wither,The pink wither or friendly wither was a recurring April Fools' mob present in both Java Edition 2.0 and 15w14a .,Entity,Images/Entity/Pink_Wither.png
Plaguewhale Slab,"A plaguewhale slab , also known as simply plaguewhale , is a modified version of the elder guardian with a purple body and a green eye. It has the same width and length, but half the height as the elder guardian.",Entity,Images/Entity/Plaguewhale_Slab.png
Poisonous Potato Zombie,"A poisonous potato zombie is a joke variant of the zombie , introduced in 24w14potato .",Entity,Images/Entity/Poisonous_Potato_Zombie.png
Rascal,"The rascal was a proposed mob featured in the Mob Vote during Minecraft Live 2022 , alongside the sniffer and tuff golem . [1] It was a mob that would have been found underground in areas below y=0. The rascal would have given the player hints to help search for it, and would have also given the player an item if it was found three times. Once the rascal had given the player the item it would have teleported away. [2]",Entity,Images/Entity/Rascal.png
Ray Tracing,Ray Tracing is a humanoid mob exclusive to the April Fools' snapshot 23w13a_or_b that spawns within the Overworld .,Entity,Images/Entity/Ray_Tracing.png
Redstone Bug,A redstone bug was a joke variant of silverfish present in the April Fool's Java Edition 2.0 update.,Entity,Images/Entity/Redstone_Bug.png
Smiling Creeper,"The smiling creeper was a passive mob present in the April Fool's Love and Hugs Update , and is a variant of the creeper .",Entity,Images/Entity/Smiling_Creeper.png
Toxifin Slab,"A toxifin slab , also known as simply toxifin , is a modified version of the guardian with an orange body and green spikes, available in 24w14potato . It has the same width and length, but half the height as a guardian.",Entity,Images/Entity/Toxifin_Slab.png
Tuff Golem,"The tuff golem was a proposed mob featured in the Mob Vote during Minecraft Live 2022 , alongside the sniffer and rascal . [1] It was a golem that would have been built by the player. If a wool block was included while building it, the tuff golem would have worn a cloak matching the color of the wool.",Entity,Images/Entity/Tuff_Golem.png
Villager,"Villagers are passive mobs that inhabit villages , work at their professions, breed, and interact with each other. Their clothing varies according to their occupation. A player can trade with villagers, using emeralds as currency. Villagers received a complete overhaul of both their appearance and their functionality in the Village & Pillage update; this page covers villagers as they appeared and behaved before the update.",Entity,Images/Entity/Villager.png
Wildfire,"Mob D, The Wildfire , called ""The Hovering Inferno"" during the vote, was a proposed mob featured in the Mob Vote during MINECON Earth 2017 , alongside the barnacle , the phantom and the great hunger . [1]",Entity,Images/Entity/Wildfire.png
Zombie,"A zombie horse is an unused variant of the regular horse . Zombie horses appear to be the horse equivalent of zombies . Like zombies, zombie horses are green-skinned and their eyes are completely black.",Entity,Images/Entity/Zombie.png
Zombie Villager,A zombie villager is a variant of the zombie that can be cured into a normal villager using a golden apple while it is under the effect of Weakness .,Entity,Images/Entity/Zombie_Villager.png
Brush,A brush is a tool used in archaeology to excavate suspicious sand and suspicious gravel for different items. It can also brush armadillos for armadillo scutes.,Features,Images/Features/Brush.png
Decorated Pot,"A decorated pot is a storage block crafted from bricks and/or pottery sherds, with the items used individually affecting the appearance of its four side faces. It can store a single inventory slot's worth of items, which cannot be seen or retrieved by hand without breaking the pot.",Features,Images/Features/Decorated_Pot.png
Music Disc Relic,"""Relic"" refers to both a song composed by Aaron Cherof, and a music disc that plays the song when inserted in a jukebox. The music disc is obtained from trail ruins, from brushing suspicious gravel.",Features,Images/Features/Music_Disc_Relic.png
Sniffer Egg,"A sniffer egg is a block that can be brushed out of suspicious sand in warm ocean ruins, or obtained by breeding two sniffers. It slowly hatches into a snifflet (baby sniffer) when placed.",Features,Images/Features/Sniffer_Egg.png
Suspicious Gravel,"Suspicious gravel is a fragile gravity-affected block found in various Overworld structures. They can be brushed to extract structure-dependent loot, and are a source of pottery sherds alongside suspicious sand and trial chambers. Suspicious gravel drops nothing if broken, and break if they fall from any height or are moved with a piston.",Features,Images/Features/Suspicious_Gravel.png
Suspicious Sand,"Suspicious sand is a fragile gravity-affected block found in various Overworld structures. They can be brushed to extract structure-dependent loot, and are a source of pottery sherds alongside suspicious gravel and trial chambers. Suspicious sand drops nothing if broken, and break if they fall from any height or are moved with a piston.",Features,Images/Features/Suspicious_Sand.png
Survival Mode,"Survival Mode is a game mode in Minecraft. In this mode, players must gather resources, build buildings, fight monsters, perform hunger management and explore the world to survive and thrive. In the Java version, progress can be earned in any mode. In the Bedrock version, achievements can be earned in Survival mode only.",GameSettings,Images/GameSettings/GameSettings.png
Creative Mode,"Creative mode is one of the main game modes in MC. Survival-related content, such as life, hunger, and saturation, has been removed; players can double-click the jump button to switch between flight states; players can instantly destroy blocks without falling objects; blocks cannot be destroyed with a sword or trident; most in-game items/blocks can be accessed by opening the Creative Mode Item Bar; blocks and items do not deplete when placed and tools do not break; and the game's BGM is changed. change.",GameSettings,Images/GameSettings/GameSettings.png
Adventure Mode,"Adventure Mode is a game mode for use on player-created maps. Players cannot destroy or place cubes at will to avoid damaging the adventure map or vandalizing the server. Players can only take items labeled with the CanDestroy tag to destroy a given cube, and can only place cubes labeled with the CanPlaceOn tag on a given cube. Players can still interact with cubes and entities.",GameSettings,Images/GameSettings/GameSettings.png
Amethyst Geode,"An amethyst geode is a feature found in the underground of the Overworld . Amethyst geodes contain smooth basalt , calcite , and are the main source of amethyst shards and blocks of amethyst .",Structure,Images/Structure/Amethyst_Geode.png
Ancient City,"An ancient city is a palatial structure found in deep dark biomes at layer -51, harboring chests containing some items that cannot be found anywhere else. It is also the largest structure in the game.",Structure,Images/Structure/Ancient_City.png
Bastion Remnant,"Bastion remnants [1] are large, castle-like generated structures found in the Nether in all of the biomes except basalt deltas . They generate in four distinct variants, each with a unique structure and set of loot. Piglins and piglin brutes spawn in these structures on generation, and hoglins may also spawn on generation in the bridge and hoglin stables variants. Bastion remnants are the only place to find gilded blackstone , the Pigstep music disc , the snout banner pattern and armor trim , monster spawners which spawn magma cubes , and the netherite upgrade smithing template.",Structure,Images/Structure/Bastion_Remnant.png
Bonus Chest,"The bonus chest is a feature that appears near the player 's spawn if the ""Bonus Chest"" option is toggled on the "" Create New World "" screen. It generates with a semi-random collection of basic items to help the player survive early on and gather necessary resources, including tools, blocks, and food.",Structure,Images/Structure/Bonus_Chest.png
Brick Pyramid,"Brick pyramids were tall experimental generated structures made up exclusively of bricks , present in Java Edition Infdev .",Structure,Images/Structure/Brick_Pyramid.png
Buried Treasure,"Buried treasure is a naturally generated structure that consists of a buried loot chest . The chest is buried primarily in beaches , and rarely in the ocean floor. Buried treasure is the only source of the heart of the sea , which can be used to craft a conduit . Buried treasure can be located using explorer maps .",Structure,Images/Structure/Buried_Treasure.png
Coral Reef,"Coral reefs are features that generate in warm ocean biomes . They consist of multiple clusters of coral blocks , coral , and coral fans . These clusters come in a wide variety of shapes, sizes, and colors.",Structure,Images/Structure/Coral_Reef.png
Desert Pyramid,"A desert pyramid is a structure found in desert biomes built mostly of sandstone . The desert pyramid contains four loot chests hidden under the floor in the center protected by a TNT trap, and a secret buried room to the side where archaeology can be performed.",Structure,Images/Structure/Desert_Pyramid.png
Desert Well,Desert wells are features consisting mostly of sandstone .,Structure,Images/Structure/Desert_Well.png
Disk,A disk is a feature consisting of a naturally generated roughly circular deposit of a soil-like block under or next to bodies of water .,Structure,Images/Structure/Disk.png
End City,"End cities are tall structures found on the outer islands of the End . They are inhabited by shulkers and hold valuable loot , including enchanted iron and diamond tools and armor . End ships , found in some end cities, are the only source of elytra .",Structure,Images/Structure/End_City.png
End gateway,End gateways are intradimensional portals generated in the End : some are spawned around the central island after each death of the ender dragon ; others are randomly generated throughout the outer islands .,Structure,Images/Structure/End_gateway.png
End platform,The end platform (also called the obsidian platform ) is a 5×1×5 square of obsidian that generates when an entity enters the End through an end portal block .,Structure,Images/Structure/End_platform.png
End spike,"End spikes [1] (also known as obsidian spikes , obsidian pillars , obsidian towers , and end pillars ) are a feature in the End that are made of obsidian .",Structure,Images/Structure/End_spike.png
Exit portal,"The exit portal (also known as the end podium or end fountain ) is a feature that enables the player to return to their spawn point , activating upon each defeat of the ender dragon .",Structure,Images/Structure/Exit_portal.png
Forest rock,A forest rock is a feature found throughout old growth taiga biomes.,Structure,Images/Structure/Forest_rock.png
Fossil,"A fossil is a rarely-occurring skeletal feature composed of bone blocks , coal ore , or diamond ore .",Structure,Images/Structure/Fossil.png
Ice Patch,Ice patches are blobs of packed ice that generate exclusively in the ice spikes biome.,Structure,Images/Structure/Ice_Patch.png
Ice Spike,Ice spikes are common features made of packed ice . Ice spikes only generate in the ice spikes biome.,Structure,Images/Structure/Ice_Spike.png
Iceberg,Iceberg may refer to:,Structure,Images/Structure/Iceberg.png
Igloo,"An igloo is a structure sometimes generated in snowy taigas , snowy plains , or snowy slopes and built mainly of snow blocks .",Structure,Images/Structure/Igloo.png
Jungle Pyramid,"Jungle pyramids , also known as jungle temples , are structures found in jungles .",Structure,Images/Structure/Jungle_Pyramid.png
Mineshaft,"Mineshafts are structures found primarily underground in the Overworld . They consist of interlinked 3×3 tunnels with incomplete rail lines running through them, with oak wood platforms bridging gaps or hanging in larger exposed caverns. Mineshafts are the only structures where cave spider monster spawners can be found.",Structure,Images/Structure/Mineshaft.png
Monster Room,"A monster room [a] is a feature found underground in the Overworld . It consists of a room with cobblestone walls and a floor made of cobblestone mixed with mossy cobblestone . A monster spawner that produces either zombies , skeletons , or spiders is found in the middle.",Structure,Images/Structure/Monster_Room.png
Nether Fortress,"A nether fortress is a large structure found in the Nether , consisting of bridges, corridors, and towers. Nether fortresses are the only place where wither skeletons and blazes spawn. They also contain nether wart .",Structure,Images/Structure/Nether_Fortress.png
Nether Fossil,Nether fossils are fossils that generate in soul sand valleys .,Structure,Images/Structure/Nether_Fossil.png
Nether Reactor,"The nether reactor was a player-built structure exclusive to Pocket Edition which, when activated, created a massive structure of netherrack and spawned large quantities of normally rare or unobtainable items.",Structure,Images/Structure/Nether_Reactor.png
Ocean Monument,"Ocean monuments , also known as simply monuments , are rare underwater generated structures found in deep ocean biomes and variants. They are inhabited by guardians and elder guardians . They are the only place where sponges can be found and one of the two places where prismarine can be found; the other being ocean ruins .",Structure,Images/Structure/Ocean_Monument.png
Ocean Ruins,"Ocean ruins are structures primarily composed of stone bricks or sandstone . They are found in ocean biomes and rarely on beaches . They contain chests , suspicious sand , and suspicious gravel , which hold a variety of loot , notably the buried treasure map and the sniffer egg . These ruins have cold and warm underwater variants that vary from large villages to single ruined huts.",Structure,Images/Structure/Ocean_Ruins.png
Pile,"A pile is a feature that generates up to 25 specific blocks, the type of which correspond to the theme of a given village .",Structure,Images/Structure/Pile.png
Pillager Outpost,A pillager outpost is an assortment of structures inhabited by pillagers .,Structure,Images/Structure/Pillager_Outpost.png
Ruined Portal,"A ruined portal is a structure resembling a damaged nether portal , which generates in both the Nether and the Overworld . It contains some decoration and (usually) a loot chest around it.",Structure,Images/Structure/Ruined_Portal.png
Shipwreck,A shipwreck is a structure found in oceanic biomes that resembles a sunken sailing ship.,Structure,Images/Structure/Shipwreck.png
Stronghold,"A stronghold is a structure that occurs naturally underground in the Overworld , and is the only place where an end portal can be found. Strongholds can be located by using an eye of ender .",Structure,Images/Structure/Stronghold.png
Swamp Hut,Swamp huts (also known as witch huts ) are small structures that have the ability to spawn witches and black cats .,Structure,Images/Structure/Swamp_Hut.png
Trail Ruins,Trail ruins are buried structures that work as archaeological sites where suspicious gravel generates. They are found in heavily forested biomes and resemble ruined villages from a lost culture. [1],Structure,Images/Structure/Trail_Ruins.png
Trial Chambers,"Trial chambers (inconsistently plural in-game [n 1] ) are underground structures that serve as a mid-game combat challenge. [1] They consist mostly of copper blocks and tuff bricks , and are the only place where trial spawners and vaults naturally generate. Trial chambers are also the only place where breezes spawn, whose breeze rods can be used to craft wind charges . Various materials such as heavy cores and certain armor trims are obtained exclusively by unlocking vaults in trial chambers. As it is the only source of breeze rods and heavy cores, the structure is also the location where maces are obtained.",Structure,Images/Structure/Trial_Chambers.png
Village,"A village is a group or complex of buildings and other structures that generate naturally in the Overworld . A village is inhabited by villagers , as people, cats , as pets/strays, iron golems , for defense, passive livestock mobs, for farms, and wandering traders with their trader llamas . A village is a source of resources to the player , obtained from trading , loot chests , and other materials found in the village. Villages are also a target of illager raids when a player with the Bad Omen effect enters a village, transforming it into Raid Omen , triggering a raid.",Structure,Images/Structure/Village.png
Woodland Mansion,"A woodland mansion is a massive systematically-generated structure found in dark forests , often far away from the world spawn point . A mansion is inhabited by vindicators , evokers , and allays , and is one of the only places where a totem of undying can be obtained. Besides illagers , a mansion's interior lighting is sufficiently low for other Overworld monsters to spawn.",Structure,Images/Structure/Woodland_Mansion.png
